{
  "checks": {
    "compare_runs": true,
    "pytest_python": true,
    "pytest_ucc": true,
    "validate_run": true
  },
  "created_at_utc": "2026-01-11T20:08:59.570827Z",
  "decision": "accept",
  "proposal_id": "v2_20260111_120817",
  "reasons": [],
  "sandbox_branch": "feat/plasticity_v2_safe_ops_20260111_120817",
  "schema": "plasticity_decision_v2",
  "thermo": {
    "allowlist_ok": true,
    "budget_ok": true,
    "notes": []
  }
}
